{"execution_session_id":"00000000-0000-4000-8000-000000000003","positions":[{"broker_authoritative":65,"canonical_instrument_id":"NSE:NSE_FNO:NIFTY:option:2026-08-27:25000.5:CE","instrument_token":"58072","ledger_reconstructed":65,"strategy_desired":65}],"provenance":"simulated","reconciliation_status":"matched","schema_version":"1.0.0","snapshot_id":"00000000-0000-4000-8000-000000000031","source":"paper","timestamp_ns":100}
